{
  "layoutVersion": 1,
  "profile": "dependency",
  "orientation": "TD",
  "entryNodeId": "entry",
  "width": 928.8900000000001,
  "height": 1394.752,
  "nodes": [
    {
      "id": "invocation",
      "title": "L1 · 模型调用与 SSE",
      "role": "action",
      "shape": "rect",
      "width": 181.04,
      "height": 54,
      "x": 373.92500000000007,
      "y": 1120.752,
      "rank": 6,
      "lines": [
        "L1 · 模型调用与 SSE"
      ]
    },
    {
      "id": "context",
      "title": "L2 · 上下文装配与封存",
      "role": "action",
      "shape": "rect",
      "width": 196.19,
      "height": 54,
      "x": 56,
      "y": 956.752,
      "rank": 5,
      "lines": [
        "L2 · 上下文装配与封存"
      ]
    },
    {
      "id": "tools",
      "title": "L3 · 工具与候选工作区",
      "role": "action",
      "shape": "rect",
      "width": 196.19,
      "height": 54,
      "x": 366.35,
      "y": 956.752,
      "rank": 5,
      "lines": [
        "L3 · 工具与候选工作区"
      ]
    },
    {
      "id": "storage",
      "title": "L3 · 持久化与事实日志",
      "role": "action",
      "shape": "rect",
      "width": 196.19,
      "height": 54,
      "x": 676.7,
      "y": 956.752,
      "rank": 5,
      "lines": [
        "L3 · 持久化与事实日志"
      ]
    },
    {
      "id": "harness",
      "title": "L3 · 权限与工具调度",
      "role": "action",
      "shape": "rect",
      "width": 181.19,
      "height": 54,
      "x": 373.85,
      "y": 792.752,
      "rank": 4,
      "lines": [
        "L3 · 权限与工具调度"
      ]
    },
    {
      "id": "loop",
      "title": "L4 · 多 Agent 任务循环",
      "role": "action",
      "shape": "rect",
      "width": 198.38,
      "height": 54,
      "x": 210.08000000000004,
      "y": 628.752,
      "rank": 3,
      "lines": [
        "L4 · 多 Agent 任务循环"
      ]
    },
    {
      "id": "scheduler",
      "title": "L5 · 图外规划 Scheduler",
      "role": "action",
      "shape": "rect",
      "width": 210.35,
      "height": 54,
      "x": 359.27000000000004,
      "y": 300.752,
      "rank": 1,
      "lines": [
        "L5 · 图外规划 Scheduler"
      ]
    },
    {
      "id": "delivery",
      "title": "L5 · 图级完成与交付",
      "role": "action",
      "shape": "rect",
      "width": 181.19,
      "height": 54,
      "x": 529.0250000000001,
      "y": 628.752,
      "rank": 3,
      "lines": [
        "L5 · 图级完成与交付"
      ]
    },
    {
      "id": "graph",
      "title": "L5 · 数据流图 Runtime",
      "role": "action",
      "shape": "rect",
      "width": 199.31,
      "height": 54,
      "x": 364.7900000000001,
      "y": 464.752,
      "rank": 2,
      "lines": [
        "L5 · 数据流图 Runtime"
      ]
    },
    {
      "id": "entry",
      "title": "入口 · TUI / Web UI",
      "role": "start",
      "shape": "round",
      "width": 175.835,
      "height": 54,
      "x": 376.52750000000003,
      "y": 136.752,
      "rank": 0,
      "lines": [
        "入口 · TUI / Web UI"
      ]
    },
    {
      "id": "provider",
      "title": "外部模型服务",
      "role": "action",
      "shape": "rect",
      "width": 160,
      "height": 54,
      "x": 384.44500000000005,
      "y": 1284.752,
      "rank": 7,
      "lines": [
        "外部模型服务"
      ]
    }
  ],
  "edges": [
    {
      "id": "e01",
      "source": "entry",
      "target": "scheduler",
      "kind": "用户目标 / 事件",
      "role": "forward",
      "points": [
        {
          "x": 464.44500000000005,
          "y": 190.752
        },
        {
          "x": 464.44500000000005,
          "y": 300.752
        }
      ],
      "label": {
        "x": 471.44500000000005,
        "y": 232.788,
        "width": 87.24,
        "height": 25.927999999999997,
        "lines": [
          "用户目标 / 事件"
        ]
      }
    },
    {
      "id": "e02",
      "source": "scheduler",
      "target": "graph",
      "kind": "受控图操作",
      "role": "forward",
      "points": [
        {
          "x": 464.44500000000005,
          "y": 354.752
        },
        {
          "x": 464.44500000000005,
          "y": 464.752
        }
      ],
      "label": {
        "x": 471.44500000000005,
        "y": 396.788,
        "width": 67,
        "height": 25.927999999999997,
        "lines": [
          "受控图操作"
        ]
      }
    },
    {
      "id": "e03",
      "source": "graph",
      "target": "loop",
      "kind": "使用",
      "role": "forward",
      "points": [
        {
          "x": 464.44500000000005,
          "y": 518.752
        },
        {
          "x": 464.44500000000005,
          "y": 573.752
        },
        {
          "x": 309.27000000000004,
          "y": 573.752
        },
        {
          "x": 309.27000000000004,
          "y": 628.752
        }
      ],
      "label": {
        "x": 471.44500000000005,
        "y": 533.288,
        "width": 34,
        "height": 25.927999999999997,
        "lines": [
          "使用"
        ]
      }
    },
    {
      "id": "e11",
      "source": "graph",
      "target": "delivery",
      "kind": "使用",
      "role": "forward",
      "points": [
        {
          "x": 464.44500000000005,
          "y": 518.752
        },
        {
          "x": 464.44500000000005,
          "y": 573.752
        },
        {
          "x": 619.6200000000001,
          "y": 573.752
        },
        {
          "x": 619.6200000000001,
          "y": 628.752
        }
      ],
      "label": {
        "x": 423.44500000000005,
        "y": 533.288,
        "width": 34,
        "height": 25.927999999999997,
        "lines": [
          "使用"
        ]
      }
    },
    {
      "id": "e04",
      "source": "loop",
      "target": "harness",
      "kind": "每轮执行",
      "role": "forward",
      "points": [
        {
          "x": 309.27000000000004,
          "y": 682.752
        },
        {
          "x": 309.27000000000004,
          "y": 737.752
        },
        {
          "x": 464.44500000000005,
          "y": 737.752
        },
        {
          "x": 464.44500000000005,
          "y": 792.752
        }
      ],
      "label": {
        "x": 316.27000000000004,
        "y": 697.288,
        "width": 56,
        "height": 25.927999999999997,
        "lines": [
          "每轮执行"
        ]
      }
    },
    {
      "id": "e05",
      "source": "harness",
      "target": "context",
      "kind": "使用",
      "role": "forward",
      "points": [
        {
          "x": 464.44500000000005,
          "y": 846.752
        },
        {
          "x": 464.44500000000005,
          "y": 901.752
        },
        {
          "x": 154.09500000000003,
          "y": 901.752
        },
        {
          "x": 154.09500000000003,
          "y": 956.752
        }
      ],
      "label": {
        "x": 471.44500000000005,
        "y": 861.288,
        "width": 34,
        "height": 25.927999999999997,
        "lines": [
          "使用"
        ]
      }
    },
    {
      "id": "e08",
      "source": "harness",
      "target": "tools",
      "kind": "使用",
      "role": "forward",
      "points": [
        {
          "x": 464.44500000000005,
          "y": 846.752
        },
        {
          "x": 464.44500000000005,
          "y": 956.752
        }
      ],
      "label": {
        "x": 423.44500000000005,
        "y": 888.788,
        "width": 34,
        "height": 25.927999999999997,
        "lines": [
          "使用"
        ]
      }
    },
    {
      "id": "e09",
      "source": "harness",
      "target": "storage",
      "kind": "使用",
      "role": "forward",
      "points": [
        {
          "x": 464.44500000000005,
          "y": 846.752
        },
        {
          "x": 464.44500000000005,
          "y": 901.752
        },
        {
          "x": 774.7950000000001,
          "y": 901.752
        },
        {
          "x": 774.7950000000001,
          "y": 956.752
        }
      ],
      "label": {
        "x": 602.6200000000001,
        "y": 870.8240000000001,
        "width": 34,
        "height": 25.927999999999997,
        "lines": [
          "使用"
        ]
      }
    },
    {
      "id": "e06",
      "source": "context",
      "target": "invocation",
      "kind": "封存后的完整请求",
      "role": "forward",
      "points": [
        {
          "x": 154.09500000000003,
          "y": 1010.752
        },
        {
          "x": 154.09500000000003,
          "y": 1065.752
        },
        {
          "x": 464.44500000000005,
          "y": 1065.752
        },
        {
          "x": 464.44500000000005,
          "y": 1120.752
        }
      ],
      "label": {
        "x": 161.09500000000003,
        "y": 1025.288,
        "width": 100,
        "height": 25.927999999999997,
        "lines": [
          "封存后的完整请求"
        ]
      }
    },
    {
      "id": "e07",
      "source": "invocation",
      "target": "provider",
      "kind": "HTTP / SSE",
      "role": "forward",
      "points": [
        {
          "x": 464.44500000000005,
          "y": 1174.752
        },
        {
          "x": 464.44500000000005,
          "y": 1284.752
        }
      ],
      "label": {
        "x": 471.44500000000005,
        "y": 1216.788,
        "width": 68.815,
        "height": 25.927999999999997,
        "lines": [
          "HTTP / SSE"
        ]
      }
    }
  ],
  "groups": [],
  "constraints": {
    "sameRank": [],
    "forwardEdgeIds": [
      "e07",
      "e05",
      "e08",
      "e09",
      "e03",
      "e11",
      "e02",
      "e06",
      "e04",
      "e01"
    ],
    "retryEdgeIds": [],
    "secondaryEdgeIds": []
  },
  "warnings": [],
  "font": {
    "family": "Noto Sans CJK SC",
    "version": "2.004",
    "size": 15
  }
}